<?xml version="1.0" encoding="UTF-8"?>
<!-- 
This example message is provided for illustrative purposes only. It has had no clinical validation. Whilst every effort has been taken to ensure that the examples are consistent with the message specification contained within the MiM, where there are conflicts with the written message specification or schema, the specification or schema shall be considered to take precedence.
-->
<query xmlns="urn:hl7-org:v3" xmlns:xsi="http://www.w3.org/2001/XMLSchema-instance" xsi:schemaLocation="urn:hl7-org:v3
../../Schemas/QURX_MT000005UK01.xsd">
	<organization.id>
		<value root="1.2.826.0.1285.0.1.10" extension="AB123"/>
		<semanticsText>Organization.id</semanticsText>
	</organization.id>
	<prescription.id>
		<value root="45D2E9DD-DA11-C266-A426-447C68D3D33A"/>
		<semanticsText>Prescription.id</semanticsText>
	</prescription.id>
	<requesterOrganizationType>
		<value code="003" codeSystem="2.16.840.1.113883.2.1.3.2.4.17.128"/>
		<semanticsText>RequesterOrganizationType</semanticsText>
	</requesterOrganizationType>
</query>
